{
  "$schema": "https://json-schema.org/draft/2020-12/schema",
  "$id": "https://schemas.hsclubs.net/v1/school-manifest.schema.json",
  "title": "HS Clubs school manifest, v1",
  "description": "Body of GET /.well-known/hsclubs-app.json on a school site: what that deployment claims about its own identity and which v1 capabilities it implements. The registry treats it as a claim, not as proof; every value is checked against the registry entry before a school is listed.",
  "type": "object",
  "required": [
    "contract",
    "version",
    "schoolId",
    "slug",
    "siteOrigin",
    "summaryUrl",
    "capabilities",
    "auth"
  ],
  "additionalProperties": true,
  "properties": {
    "contract": { "const": "hsclubs.school-manifest" },
    "version": { "const": 1 },
    "schoolId": { "$ref": "#/$defs/schoolId" },
    "slug": { "$ref": "#/$defs/slug" },
    "schoolName": { "type": ["string", "null"], "maxLength": 200 },
    "siteOrigin": { "$ref": "#/$defs/httpsOrigin" },
    "summaryUrl": { "$ref": "#/$defs/httpsUrl" },
    "capabilities": {
      "description": "Contracts this deployment implements. A consumer must ignore names it does not know rather than reject the manifest.",
      "type": "array",
      "maxItems": 32,
      "items": { "type": "string", "pattern": "^[a-z][a-z0-9-]*\\.v[0-9]+$" }
    },
    "auth": {
      "type": "object",
      "required": ["mobile"],
      "additionalProperties": true,
      "properties": {
        "mobile": {
          "type": "object",
          "required": ["supported"],
          "additionalProperties": true,
          "properties": {
            "supported": { "type": "boolean" },
            "startUrl": { "$ref": "#/$defs/httpsUrl" },
            "completeUrl": { "$ref": "#/$defs/httpsUrl" },
            "callbackUrl": { "$ref": "#/$defs/httpsUrl" },
            "codeChallengeMethods": {
              "type": "array",
              "minItems": 1,
              "items": { "const": "S256" }
            }
          },
          "allOf": [
            {
              "description": "A deployment that claims mobile auth must say where the flow starts and ends.",
              "if": { "properties": { "supported": { "const": true } } },
              "then": {
                "required": ["startUrl", "completeUrl", "callbackUrl", "codeChallengeMethods"]
              }
            }
          ]
        }
      }
    },
    "publishedAt": { "$ref": "#/$defs/instant" }
  },
  "$defs": {
    "schoolId": { "type": "string", "pattern": "^sch_[A-Za-z0-9]{16,48}$" },
    "slug": { "type": "string", "pattern": "^[a-z0-9](?:[a-z0-9-]{0,62}[a-z0-9])?$" },
    "httpsOrigin": {
      "description": "Scheme, host and optional port only: no path, query or fragment.",
      "type": "string",
      "pattern": "^https://[a-z0-9.-]+(?::\\d{2,5})?$"
    },
    "httpsUrl": { "type": "string", "pattern": "^https://[a-z0-9.-]+(?::\\d{2,5})?/[^\\s]*$" },
    "instant": {
      "type": "string",
      "pattern": "^\\d{4}-\\d{2}-\\d{2}T\\d{2}:\\d{2}:\\d{2}(?:\\.\\d+)?(?:Z|[+-]\\d{2}:?\\d{2})$"
    }
  }
}
